{
  "schema": 2,
  "harness": "pi",
  "harnessVersion": "0.87.1",
  "case": "held-at-prompt",
  "recordedAt": "2026-09-30T12:13:43.680Z",
  "snapshots": [
    {
      "label": "held",
      "at": "2026-09-30T12:13:43.656Z",
      "records": {
        "pi-porch-conformance-56162b91.json": {
          "schema": 2,
          "harness": "pi",
          "session": "porch-conformance-56162b91",
          "createdAt": "2026-09-30T12:13:43.513Z",
          "updatedAt": "2026-09-30T12:13:43.548Z",
          "inside": {
            "pid": 54483,
            "status": "idle",
            "delivery": {
              "via": "socket",
              "address": "/tmp/porch-501/pi-54483.sock"
            },
            "cwd": "/private$WORK/cwd-56162b91",
            "data": {
              "processStartedAt": "2026-09-30T12:13:43.316Z",
              "sessionFile": "$WORK/sessions/2026-09-30T12-13-43-453Z_porch-conformance-56162b91.jsonl",
              "mode": "rpc",
              "source": "startup",
              "prompt": {
                "kind": "confirm",
                "title": "Porch conformance",
                "since": "2026-09-30T12:13:43.547Z"
              },
              "lastError": null
            },
            "since": "2026-09-30T12:13:43.513Z"
          },
          "self": null
        }
      },
      "io": [
        {
          "op": "run",
          "cmd": "ps",
          "args": [
            "-o",
            "pid=,etime=",
            "-p",
            "54483"
          ],
          "result": {
            "code": 0,
            "stdout": "54483 00:00\n",
            "stderr": ""
          }
        }
      ],
      "observations": [
        {
          "schema": 2,
          "harness": "pi",
          "session": "porch-conformance-56162b91",
          "attached": true,
          "status": "waiting-on-prompt",
          "since": "2026-09-30T12:13:43.547Z",
          "endReason": null,
          "detail": {
            "pid": 54483,
            "cwd": "/private$WORK/cwd-56162b91",
            "mode": "rpc",
            "sessionFile": "$WORK/sessions/2026-09-30T12-13-43-453Z_porch-conformance-56162b91.jsonl",
            "prompt": {
              "kind": "confirm",
              "title": "Porch conformance"
            },
            "hasInsidePart": true,
            "lastTurnStart": null,
            "lastTurnEnd": null
          },
          "raw": {
            "record": {
              "schema": 2,
              "harness": "pi",
              "session": "porch-conformance-56162b91",
              "createdAt": "2026-09-30T12:13:43.513Z",
              "updatedAt": "2026-09-30T12:13:43.548Z",
              "inside": {
                "pid": 54483,
                "status": "idle",
                "delivery": {
                  "via": "socket",
                  "address": "/tmp/porch-501/pi-54483.sock"
                },
                "cwd": "/private$WORK/cwd-56162b91",
                "data": {
                  "processStartedAt": "2026-09-30T12:13:43.316Z",
                  "sessionFile": "$WORK/sessions/2026-09-30T12-13-43-453Z_porch-conformance-56162b91.jsonl",
                  "mode": "rpc",
                  "source": "startup",
                  "prompt": {
                    "kind": "confirm",
                    "title": "Porch conformance",
                    "since": "2026-09-30T12:13:43.547Z"
                  },
                  "lastError": null
                },
                "since": "2026-09-30T12:13:43.513Z"
              },
              "self": null
            },
            "ps": "54483 00:00"
          },
          "self": null
        }
      ]
    },
    {
      "label": "after delivery",
      "at": "2026-09-30T12:13:43.676Z",
      "records": {
        "pi-porch-conformance-56162b91.json": {
          "schema": 2,
          "harness": "pi",
          "session": "porch-conformance-56162b91",
          "createdAt": "2026-09-30T12:13:43.513Z",
          "updatedAt": "2026-09-30T12:13:43.548Z",
          "inside": {
            "pid": 54483,
            "status": "idle",
            "delivery": {
              "via": "socket",
              "address": "/tmp/porch-501/pi-54483.sock"
            },
            "cwd": "/private$WORK/cwd-56162b91",
            "data": {
              "processStartedAt": "2026-09-30T12:13:43.316Z",
              "sessionFile": "$WORK/sessions/2026-09-30T12-13-43-453Z_porch-conformance-56162b91.jsonl",
              "mode": "rpc",
              "source": "startup",
              "prompt": {
                "kind": "confirm",
                "title": "Porch conformance",
                "since": "2026-09-30T12:13:43.547Z"
              },
              "lastError": null
            },
            "since": "2026-09-30T12:13:43.513Z"
          },
          "self": null
        }
      },
      "io": [
        {
          "op": "run",
          "cmd": "ps",
          "args": [
            "-o",
            "pid=,etime=",
            "-p",
            "54483"
          ],
          "result": {
            "code": 0,
            "stdout": "54483 00:00\n",
            "stderr": ""
          }
        }
      ],
      "observations": [
        {
          "schema": 2,
          "harness": "pi",
          "session": "porch-conformance-56162b91",
          "attached": true,
          "status": "waiting-on-prompt",
          "since": "2026-09-30T12:13:43.547Z",
          "endReason": null,
          "detail": {
            "pid": 54483,
            "cwd": "/private$WORK/cwd-56162b91",
            "mode": "rpc",
            "sessionFile": "$WORK/sessions/2026-09-30T12-13-43-453Z_porch-conformance-56162b91.jsonl",
            "prompt": {
              "kind": "confirm",
              "title": "Porch conformance"
            },
            "hasInsidePart": true,
            "lastTurnStart": null,
            "lastTurnEnd": null
          },
          "raw": {
            "record": {
              "schema": 2,
              "harness": "pi",
              "session": "porch-conformance-56162b91",
              "createdAt": "2026-09-30T12:13:43.513Z",
              "updatedAt": "2026-09-30T12:13:43.548Z",
              "inside": {
                "pid": 54483,
                "status": "idle",
                "delivery": {
                  "via": "socket",
                  "address": "/tmp/porch-501/pi-54483.sock"
                },
                "cwd": "/private$WORK/cwd-56162b91",
                "data": {
                  "processStartedAt": "2026-09-30T12:13:43.316Z",
                  "sessionFile": "$WORK/sessions/2026-09-30T12-13-43-453Z_porch-conformance-56162b91.jsonl",
                  "mode": "rpc",
                  "source": "startup",
                  "prompt": {
                    "kind": "confirm",
                    "title": "Porch conformance",
                    "since": "2026-09-30T12:13:43.547Z"
                  },
                  "lastError": null
                },
                "since": "2026-09-30T12:13:43.513Z"
              },
              "self": null
            },
            "ps": "54483 00:00"
          },
          "self": null
        }
      ]
    }
  ]
}
