{
  "schema": 2,
  "harness": "fake",
  "harnessVersion": "fake-1",
  "case": "which-session-am-i",
  "recordedAt": "2026-09-30T12:10:24.127Z",
  "snapshots": [
    {
      "label": "started",
      "at": "2026-09-30T12:10:24.125Z",
      "records": {
        "fake-conf-d933b50a.json": {
          "schema": 2,
          "harness": "fake",
          "session": "conf-d933b50a",
          "createdAt": "2026-09-30T12:10:24.123Z",
          "updatedAt": "2026-09-30T12:10:24.123Z",
          "inside": {
            "pid": 46851,
            "status": "idle",
            "delivery": {
              "via": "fake",
              "address": "fake:conf-d933b50a"
            },
            "since": "2026-09-30T12:10:24.124Z"
          },
          "self": null
        }
      },
      "io": [
        {
          "op": "readFile",
          "path": "$PORCH_HOME/fake-harness.json",
          "result": "{\n  \"sessions\": {\n    \"conf-d933b50a\": {\n      \"alive\": true,\n      \"pid\": 46851,\n      \"prompt\": null,\n      \"promptSince\": null,\n      \"goneSince\": null,\n      \"failDeliver\": null,\n      \"exitCode\": null\n    }\n  },\n  \"deliveries\": []\n}\n"
        }
      ],
      "observations": [
        {
          "schema": 2,
          "harness": "fake",
          "session": "conf-d933b50a",
          "attached": true,
          "status": "idle",
          "since": "2026-09-30T12:10:24.124Z",
          "endReason": null,
          "detail": {
            "pid": 46851,
            "prompt": null,
            "hasInsidePart": true,
            "lastTurnStart": null,
            "lastTurnEnd": null,
            "backgroundTasks": null
          },
          "raw": {
            "listing": {
              "alive": true,
              "pid": 46851,
              "prompt": null,
              "promptSince": null,
              "goneSince": null,
              "failDeliver": null,
              "exitCode": null
            },
            "record": {
              "schema": 2,
              "harness": "fake",
              "session": "conf-d933b50a",
              "createdAt": "2026-09-30T12:10:24.123Z",
              "updatedAt": "2026-09-30T12:10:24.123Z",
              "inside": {
                "pid": 46851,
                "status": "idle",
                "delivery": {
                  "via": "fake",
                  "address": "fake:conf-d933b50a"
                },
                "since": "2026-09-30T12:10:24.124Z"
              },
              "self": null
            }
          },
          "self": null
        }
      ]
    }
  ]
}
