{
  "schema": 2,
  "harness": "pi",
  "harnessVersion": "0.87.1",
  "case": "deliver-while-idle",
  "recordedAt": "2026-09-30T12:13:18.310Z",
  "snapshots": [
    {
      "label": "idle",
      "at": "2026-09-30T12:13:15.938Z",
      "records": {
        "pi-porch-conformance-f4036a00.json": {
          "schema": 2,
          "harness": "pi",
          "session": "porch-conformance-f4036a00",
          "createdAt": "2026-09-30T12:13:15.882Z",
          "updatedAt": "2026-09-30T12:13:15.882Z",
          "inside": {
            "pid": 54075,
            "status": "idle",
            "delivery": {
              "via": "socket",
              "address": "/tmp/porch-501/pi-54075.sock"
            },
            "cwd": "/private$WORK/cwd-f4036a00",
            "data": {
              "processStartedAt": "2026-09-30T12:13:15.702Z",
              "sessionFile": "$WORK/sessions/2026-09-30T12-13-15-835Z_porch-conformance-f4036a00.jsonl",
              "mode": "rpc",
              "source": "startup",
              "prompt": null,
              "lastError": null
            },
            "since": "2026-09-30T12:13:15.882Z"
          },
          "self": null
        }
      },
      "io": [
        {
          "op": "run",
          "cmd": "ps",
          "args": [
            "-o",
            "pid=,etime=",
            "-p",
            "54075"
          ],
          "result": {
            "code": 0,
            "stdout": "54075 00:00\n",
            "stderr": ""
          }
        }
      ],
      "observations": [
        {
          "schema": 2,
          "harness": "pi",
          "session": "porch-conformance-f4036a00",
          "attached": true,
          "status": "idle",
          "since": "2026-09-30T12:13:15.882Z",
          "endReason": null,
          "detail": {
            "pid": 54075,
            "cwd": "/private$WORK/cwd-f4036a00",
            "mode": "rpc",
            "sessionFile": "$WORK/sessions/2026-09-30T12-13-15-835Z_porch-conformance-f4036a00.jsonl",
            "prompt": null,
            "hasInsidePart": true,
            "lastTurnStart": null,
            "lastTurnEnd": null
          },
          "raw": {
            "record": {
              "schema": 2,
              "harness": "pi",
              "session": "porch-conformance-f4036a00",
              "createdAt": "2026-09-30T12:13:15.882Z",
              "updatedAt": "2026-09-30T12:13:15.882Z",
              "inside": {
                "pid": 54075,
                "status": "idle",
                "delivery": {
                  "via": "socket",
                  "address": "/tmp/porch-501/pi-54075.sock"
                },
                "cwd": "/private$WORK/cwd-f4036a00",
                "data": {
                  "processStartedAt": "2026-09-30T12:13:15.702Z",
                  "sessionFile": "$WORK/sessions/2026-09-30T12-13-15-835Z_porch-conformance-f4036a00.jsonl",
                  "mode": "rpc",
                  "source": "startup",
                  "prompt": null,
                  "lastError": null
                },
                "since": "2026-09-30T12:13:15.882Z"
              },
              "self": null
            },
            "ps": "54075 00:00"
          },
          "self": null
        }
      ]
    },
    {
      "label": "after delivery",
      "at": "2026-09-30T12:13:18.304Z",
      "records": {
        "pi-porch-conformance-f4036a00.json": {
          "schema": 2,
          "harness": "pi",
          "session": "porch-conformance-f4036a00",
          "createdAt": "2026-09-30T12:13:15.882Z",
          "updatedAt": "2026-09-30T12:13:15.951Z",
          "inside": {
            "pid": 54075,
            "status": "busy",
            "delivery": {
              "via": "socket",
              "address": "/tmp/porch-501/pi-54075.sock"
            },
            "cwd": "/private$WORK/cwd-f4036a00",
            "data": {
              "processStartedAt": "2026-09-30T12:13:15.702Z",
              "sessionFile": "$WORK/sessions/2026-09-30T12-13-15-835Z_porch-conformance-f4036a00.jsonl",
              "mode": "rpc",
              "source": "startup",
              "prompt": null,
              "lastError": null
            },
            "since": "2026-09-30T12:13:15.951Z",
            "lastTurnStart": "2026-09-30T12:13:15.950Z"
          },
          "self": null
        }
      },
      "io": [
        {
          "op": "run",
          "cmd": "ps",
          "args": [
            "-o",
            "pid=,etime=",
            "-p",
            "54075"
          ],
          "result": {
            "code": 0,
            "stdout": "54075 00:03\n",
            "stderr": ""
          }
        }
      ],
      "observations": [
        {
          "schema": 2,
          "harness": "pi",
          "session": "porch-conformance-f4036a00",
          "attached": true,
          "status": "busy",
          "since": "2026-09-30T12:13:15.951Z",
          "endReason": null,
          "detail": {
            "pid": 54075,
            "cwd": "/private$WORK/cwd-f4036a00",
            "mode": "rpc",
            "sessionFile": "$WORK/sessions/2026-09-30T12-13-15-835Z_porch-conformance-f4036a00.jsonl",
            "prompt": null,
            "hasInsidePart": true,
            "lastTurnStart": "2026-09-30T12:13:15.950Z",
            "lastTurnEnd": null
          },
          "raw": {
            "record": {
              "schema": 2,
              "harness": "pi",
              "session": "porch-conformance-f4036a00",
              "createdAt": "2026-09-30T12:13:15.882Z",
              "updatedAt": "2026-09-30T12:13:15.951Z",
              "inside": {
                "pid": 54075,
                "status": "busy",
                "delivery": {
                  "via": "socket",
                  "address": "/tmp/porch-501/pi-54075.sock"
                },
                "cwd": "/private$WORK/cwd-f4036a00",
                "data": {
                  "processStartedAt": "2026-09-30T12:13:15.702Z",
                  "sessionFile": "$WORK/sessions/2026-09-30T12-13-15-835Z_porch-conformance-f4036a00.jsonl",
                  "mode": "rpc",
                  "source": "startup",
                  "prompt": null,
                  "lastError": null
                },
                "since": "2026-09-30T12:13:15.951Z",
                "lastTurnStart": "2026-09-30T12:13:15.950Z"
              },
              "self": null
            },
            "ps": "54075 00:03"
          },
          "self": null
        }
      ]
    }
  ]
}
